{
  "$schema": "https://json-schema.org/draft/2020-12/schema",
  "$id": "https://ludion.ai/lessons.schema.json",
  "title": "Ludion lesson (v0)",
  "description": "One taught unit of knowledge. Immutable. Lives at lessons/<subject>/<id>.json. If it is on main, it was verified.",
  "type": "object",
  "required": ["id", "subject", "claim", "evidence", "author", "author_id", "created_at"],
  "additionalProperties": false,
  "properties": {
    "id": {"type": "string", "pattern": "^[0-9A-HJKMNP-TV-Z]{26}$", "description": "ULID"},
    "subject": {"type": "string", "pattern": "^[a-z0-9][a-z0-9.-]{0,63}$", "description": "Directory name. A library, a tool, a field."},
    "version": {"type": ["string", "null"], "description": "Version range the claim holds for, e.g. >=3.12"},
    "claim": {"type": "string", "minLength": 10, "maxLength": 400, "description": "One sentence, as the teacher wrote it."},
    "evidence": {
      "type": "array",
      "minItems": 1,
      "maxItems": 3,
      "items": {
        "oneOf": [
          {
            "type": "object", "required": ["run"], "additionalProperties": false,
            "properties": {"run": {"type": "object", "required": ["runner", "code"], "additionalProperties": false,
              "properties": {"runner": {"type": "string", "enum": ["python", "bash", "node", "lean"]},
                             "code": {"type": "string", "maxLength": 8000, "description": "Exits 0 iff the claim holds. Exit 0 with 'skip:' on stdout if the runner cannot test it."}}}}
          },
          {
            "type": "object", "required": ["source"], "additionalProperties": false,
            "properties": {"source": {"type": "object", "required": ["url", "quote"], "additionalProperties": false,
              "properties": {"url": {"type": "string", "pattern": "^https://"},
                             "quote": {"type": "string", "minLength": 8, "maxLength": 300, "description": "Exact span that appears on the page and supports the claim."}}}}
          }
        ]
      }
    },
    "author": {"type": "string", "pattern": "^github:[A-Za-z0-9-]{1,39}$", "description": "github:<login> of the signing account at signing time. For display; identity is author_id."},
    "author_id": {"type": "integer", "minimum": 1, "description": "GitHub numeric user id of the account that signed. This is the teacher's identity. CI enforces it."},
    "replaces": {"type": "array", "items": {"type": "string", "pattern": "^[0-9A-HJKMNP-TV-Z]{26}$"}, "description": "Lessons this one corrects. The old ones stay in history."},
    "created_at": {"type": "string", "pattern": "^\\d{4}-\\d{2}-\\d{2}T\\d{2}:\\d{2}:\\d{2}Z$"}
  }
}
