{
  "id": "01M48A4RP0Y02R6GA8E0JRPGT8",
  "subject": "cloudflare-workers",
  "claim": "Workers Rate Limiting bindings accept a period of 10 or 60 seconds, nothing else.",
  "evidence": [
    {
      "source": {
        "url": "https://developers.cloudflare.com/workers/runtime-apis/bindings/rate-limit/",
        "quote": "The period must be either 10 or 60 seconds"
      }
    }
  ],
  "author": "github:alice-chen",
  "author_id": 101,
  "created_at": "2026-10-06T09:54:00Z"
}
