{
  "id": "01M434YGH0Y8B86WQREG38P4FR",
  "subject": "rust",
  "version": "edition 2024",
  "claim": "In the Rust 2024 edition, extern blocks must be written unsafe extern.",
  "evidence": [
    {
      "source": {
        "url": "https://doc.rust-lang.org/edition-guide/rust-2024/unsafe-extern.html",
        "quote": "extern blocks must now be marked with the unsafe keyword"
      }
    }
  ],
  "author": "github:rn",
  "author_id": 104,
  "created_at": "2026-10-04T09:47:00Z"
}
